{
  "schema_version": "1.1",
  "diagnosis_id": "c03997a4-e1ef-5a94-8a2e-62d9694d7642",
  "incident_id": "5893b198-6ad5-5708-bb7e-a0d2ca4ca323",
  "diagnosis_version": 1,
  "provider": {
    "name": "deterministic",
    "model": "deterministic-rules-1",
    "fallback_from": null
  },
  "model_version": "deterministic-rules-1",
  "prompt_version": "none",
  "created_at": "2026-10-07T21:49:41.208Z",
  "status": "abstained",
  "abstain": true,
  "supporting_claims": [],
  "alternative_hypotheses": [],
  "confidence": {
    "value": "low",
    "explanation": "The evidence is insufficient or does not match a rule this agent understands, so no cause is asserted."
  },
  "missing_evidence": [
    "Exactly one deployment row and three trace rows"
  ],
  "reasoning_summary": "The stored evidence does not satisfy what this agent needs to diagnose the incident, so no cause is asserted. Missing: Exactly one deployment row and three trace rows.",
  "remediation_recommendation": {
    "action_type": "investigate",
    "summary": "Investigate why the incident's evidence does not meet the diagnosis requirements.",
    "parameters": {},
    "risk": "low",
    "expected_effect": "A complete, matching evidence set allows a diagnosis.",
    "rollback_note": "Nothing was changed, so there is nothing to roll back.",
    "executable": false,
    "requires_approval": true
  },
  "input_digest": "sha256:0982a6a74d713026231a46b4676157070d42e1865c03e529c50dd3e93c02b418"
}
